[
  { "r":1,  "sym":"MTNN",       "co":"MTN Nigeria Comms",      "sec":"Telecoms",  "price":760.00, "day":0.00,  "week":13.50, "ytd":13.50, "capN":"₦16.37T", "capV":16370, "vol":"12.4M", "volV":12.4, "os":"21.5B", "lo":572,  "hi":779.7, "div":4.2, "pe":18.2, "up":true  },
  { "r":2,  "sym":"BUAFOODS",   "co":"BUA Foods Plc",          "sec":"Consumer",  "price":798.90, "day":0.00,  "week":0.00,  "ytd":0.00,  "capN":"₦14.38T", "capV":14380, "vol":"2.1M",  "volV":2.1,  "os":"18.0B", "lo":750,  "hi":800,   "div":1.8, "pe":22.4, "up":true  },
  { "r":3,  "sym":"DANGCEM",    "co":"Dangote Cement",         "sec":"Industrial","price":630.00, "day":10.13, "week":10.13, "ytd":27.3,  "capN":"₦13.50T", "capV":13500, "vol":"8.2M",  "volV":8.2,  "os":"17.0B", "lo":478,  "hi":630,   "div":5.1, "pe":16.7, "up":true  },
  { "r":4,  "sym":"AIRTELAFRI", "co":"Airtel Africa Plc",      "sec":"Telecoms",  "price":2270.00,"day":-0.44, "week":-0.44, "ytd":5.3,   "capN":"₦8.53T",  "capV":8530,  "vol":"0.8M",  "volV":0.8,  "os":"3.76B", "lo":2019, "hi":2400,  "div":3.2, "pe":14.8, "up":false },
  { "r":5,  "sym":"BUACEMENT",  "co":"BUA Cement Plc",         "sec":"Industrial","price":178.50, "day":9.38,  "week":9.38,  "ytd":92.0,  "capN":"₦6.87T",  "capV":6870,  "vol":"5.6M",  "volV":5.6,  "os":"33.9B", "lo":93,   "hi":180,   "div":2.8, "pe":24.1, "up":true  },
  { "r":6,  "sym":"SEPLAT",     "co":"Seplat Energy",          "sec":"Oil & Gas", "price":5809.00,"day":8.33,  "week":15.34, "ytd":15.34, "capN":"₦5.03T",  "capV":5030,  "vol":"0.4M",  "volV":0.4,  "os":"588M",  "lo":5200, "hi":5900,  "div":2.1, "pe":8.4,  "up":true  },
  { "r":7,  "sym":"ARADEL",     "co":"Aradel Holdings",        "sec":"Oil & Gas", "price":810.00, "day":9.73,  "week":16.42, "ytd":16.42, "capN":"₦4.76T",  "capV":4760,  "vol":"1.9M",  "volV":1.9,  "os":"5.88B", "lo":680,  "hi":830,   "div":1.4, "pe":6.8,  "up":true  },
  { "r":8,  "sym":"GTCO",       "co":"Guaranty Trust Hldg",    "sec":"Banking",   "price":72.50,  "day":4.44,  "week":4.44,  "ytd":30.2,  "capN":"₦4.29T",  "capV":4290,  "vol":"18.3M", "volV":18.3, "os":"29.4B", "lo":55,   "hi":76,    "div":6.8, "pe":4.2,  "up":true  },
  { "r":9,  "sym":"ZENITHBANK", "co":"Zenith Bank Plc",        "sec":"Banking",   "price":61.80,  "day":6.27,  "week":14.89, "ytd":14.89, "capN":"₦2.93T",  "capV":2930,  "vol":"79.4M", "volV":79.4, "os":"31.4B", "lo":45.5, "hi":64,    "div":7.4, "pe":3.8,  "up":true  },
  { "r":10, "sym":"GEREGU",     "co":"Geregu Power Plc",       "sec":"Utilities", "price":880.00, "day":2.10,  "week":2.10,  "ytd":8.6,   "capN":"₦2.85T",  "capV":2850,  "vol":"1.1M",  "volV":1.1,  "os":"2.5B",  "lo":760,  "hi":910,   "div":0.9, "pe":21.3, "up":true  },
  { "r":11, "sym":"UBA",        "co":"United Bank for Africa", "sec":"Banking",   "price":34.10,  "day":1.45,  "week":1.45,  "ytd":19.4,  "capN":"₦2.70T",  "capV":2700,  "vol":"22.1M", "volV":22.1, "os":"34.2B", "lo":26,   "hi":36,    "div":8.2, "pe":3.4,  "up":true  },
  { "r":12, "sym":"ACCESS",     "co":"Access Holdings Plc",    "sec":"Banking",   "price":26.40,  "day":4.44,  "week":4.44,  "ytd":22.1,  "capN":"₦2.40T",  "capV":2400,  "vol":"31.7M", "volV":31.7, "os":"35.5B", "lo":20,   "hi":28,    "div":5.6, "pe":3.1,  "up":true  },
  { "r":13, "sym":"FIRSTHOLDCO","co":"First HoldCo Plc",       "sec":"Banking",   "price":44.00,  "day":12.15, "week":12.15, "ytd":18.4,  "capN":"₦1.58T",  "capV":1580,  "vol":"14.8M", "volV":14.8, "os":"35.9B", "lo":30,   "hi":44,    "div":4.3, "pe":4.8,  "up":true  },
  { "r":14, "sym":"LAFARGE",    "co":"Lafarge Africa Plc",     "sec":"Industrial","price":112.80, "day":11.41, "week":15.99, "ytd":15.99, "capN":"₦1.81T",  "capV":1810,  "vol":"6.3M",  "volV":6.3,  "os":"16.1B", "lo":78,   "hi":113,   "div":3.4, "pe":12.6, "up":true  },
  { "r":15, "sym":"NESTLE",     "co":"Nestle Nigeria Plc",     "sec":"Consumer",  "price":3100.00,"day":0.00,  "week":0.00,  "ytd":-2.2,  "capN":"₦2.47T",  "capV":2470,  "vol":"0.2M",  "volV":0.2,  "os":"793M",  "lo":2450, "hi":3200,  "div":2.1, "pe":28.4, "up":true  },
  { "r":16, "sym":"NGXGROUP",   "co":"NGX Group Plc",          "sec":"Financial", "price":112.95, "day":9.78,  "week":9.78,  "ytd":61.4,  "capN":"₦222B",   "capV":222,   "vol":"3.2M",  "volV":3.2,  "os":"1.97B", "lo":70,   "hi":123,   "div":2.46,"pe":11.2, "up":true  }
]
